Paradigms,JudgingType
Do not speak very fast as I will miss half of what you say. It would be nice if you explained complex debater lingo to me. Please time yourself and time your opponents. ,1
"I have done Public Forum Debate for 4 years and am familiar with the format. I will primarily be judging the round based on the technical aspects, focusing on what pieces of offense are left by the end of the round by the teams and then weighing these arguments based on a framework to determine my vote. Narratives and rhetoric will affect the frameworks I choose to adopt in my judgment of the round. I will not consider new arguments and evidence developed during and after 2nd summary unless they are clearly interacting with previous statements made. ",2
"Traditional judge that likes to see contentions well developed or negated through strong, sound, and logical arguments. Please enunciate clearly. While spreading can be advantageous in your rebuttals, please do not forsake the quality of your arguments for speed, especially during your construct. I value respect so please be mannerly in your conduct toward judge and fellow opponent. I have judged at local and national tournaments. ",2
"Debated for two years in Public Forum at my previous high school. I'm currently a freshman at Hunter College, where I compete in moot court and mock trial. I'm probably tech > truth, meaning I'm not going to vote on unwarranted and poorly contextualized arguments. I should see your arguments properly extended in both of these speeches, that means both the warrant and the impact. Also, nothing you bring up in final is going to matter for my ballot if it wasn't also in summary (exception is that defense is sticky). I know some judges are ok with new weighing in final, but I'm personally not a fan of it. Weighing arguments is the easiest way to win the round. I should at least be seeing discussion on magnitude, scope, probability, but introducing things like strength of link, clarity of impact, etc, will usually earn you my ballot and good speaks. Start this as early in the round as possible (ideally rebuttal), and do it in every possible instance. This means that in addition to seeing you weigh arguments, I want to see you weigh and implicate things like turns. ",3
"Correspondence: albert-yang@mail.com. Yes, without the G. Background: Judging from Indonesia (literally a day ahead of US time). I judged several varsity level British/Asian/Australs parliamentary debating tournaments around Southeast Asia from 2016 till 2021. As of Feb 2022, I judged a total of 4 different PF competitions in the US. Technicalities: Some judges may put a heavy emphasis on the presence of evidence and the presentation of examples, but for me coherent logical explanation and step-by-step analysis of your argument is more valuable. Spewing out too much evidence and example before you explain your logic confuses me. Use those data to back up your arguments, not to lengthen your speech. Strategy: Don't ever forget to weigh in your arguments against your opponent's. I also expect the two-worlds scenario when you're painting your case. If you only talk about your best case and your rival's worst case, then there's no debate at all. I love the ""even ifs"" and the clear-cut comparison between your model and your rival's model, that helps me judge better. Online manner: Please speak clearly and don't rap out your speech. You know, internet problems. You may turn off cameras if you (or I happen to) experience lags. ",2
"I am a parent PF judge, and a practicing attorney with more than 25 years of experience. I believe a sound debate is about a fair, intelligible and intelligent dialogue. Speed reading off a computer screen or spreading is incompatible with such a process. Fast speakers assume the risk that I could miss some arguments/points/evidence. Additionally, if in my view you've spoken at a fast clip, I will not view unfavorably your opponent failing to respond to an argument that you have advanced. I flow arguments. While I do not take note of points made/unmade in crossfire, I pay careful attention to astute questions and answers. I prize the ability to think on one's feet and deliver a cogent response. Please bring up crossfire points that you would like me to flow in a subsequent speech. I am persuaded by well-structured, logical and linked arguments that are honestly supported by key pieces of evidence. The team advancing a contention must rejoin the issue and tell me why the opposing team's rebuttal/counter/block does not work. In crossfire, please avoid questions with long preambles. While, for the most part, I don't get into the weeds with cards and evidence, I may on occasion call for a piece. Teams should feel free to assail each other's evidence during the debate. Please do not use debate jargon. Keep the discourse civil. Incivility in any form will hurt your cause. Enthusiasm for, intensity, and passion regarding the proposition you are espousing is welcome. Discourtesy or aggression against your opponents is not. Tactical and strategic thinking in arguing, rebutting, and in crossfire is always delightful. I appreciate clear analysis of why your contention should win the day in the summary and final focus. Further, the final focus should have all that you would like me to vote on (akin to writing my RFD for me - pros of your case and cons of your opponent's.) Lastly, all arguments and evidence that are in the final focus must have been in the summary - it is a matter of fairness. Happy debating! ",1
"I have 9 years experience in coaching and judging various forms of debate and very much enjoy the opportunity to judge. For Policy and Public Forum, I judge as a policy maker and not truly on a line by line (but will evaluate all arguments in the context of a policy making decision). Please analyze the opponents case/points and prove why their opponent's case is either without foundation or weak and the policy position should not be adopted. Speed is an issue if the speaker is unintelligible. Speaker points will reflect that problem, additionally, if I don't understand, I can't flow, and if it is not on my flow, I cannot evaluate. Clarity is of utmost importance. Teams should properly provide clear ""taglines"" for their arguments in order for me to follow (I will not accept flash drives). Debater professionalism and courtesy are appreciated. ",2
A competitor will be awarded the ballot if their argument effectively meets the burden of proof/ or significantly disproves their opponents. Speakers should use clear and concise language in defining their resolution terminology and are expected to use credible sources to exemplify their case. Speakers should also strive to provide a framework and structer to their argument.  ,1
"Hi! I have a British Parliamentary background. Few implications of this on you: 1. No theory - I want to see a debate about the resolution, and your opponents do too 2. Speak slow-ish - If you spread, I won't flow. 3. I always prefer realistic impacts over increasing the chance of nuclear warfare by 0.001% 4. Warranting> Evidence generally - I care about what you think, not what some random authors on the internet do. In most cases statistics only prove correlation. This is NOT good enough to win a claim. 5. Be nice to your opponents (esp in cx) or I won't be nice to your speaks LD specific: No Kritik, no theory. I would very much like to see the actual resolution being debated ",1
"kenan.s.anderson@gmail.com UPDATE for Minneapple 2021:  I haven't judged Varsity LD since... I don't even know when. So slow down A LOT and anything invented in the last 1.5 years I probably won't know about.  I have a strong natural inclination to consequentialism. If your framework is not consequentialist, especially if it's a critical ROB or ROJ, you need to explain VERY DIRECTLY and VERY BLUNTLY how it filters offense. Otherwise, I'll probably not understand and evaluate the round differently than you would like. I debated on the circuit for four years. In general, I think debate would be better if it was slightly slower, much more topic-focused, more accessible to lay folks, and had way way way less theory. I'm saddened by the number of rounds that are not resolved by whether the core issue of the topic is good/bad. You should win because you have good arguments, not because you tricked your opponent in some technical game of extensions and cross applications. Disclosure is probably good. Needlessly specific disclosure shells are probably not. A Note On Speaker Points: Evaluating some sort of ""subjective"" skill in a single debate is hard. Instead, I use speaker points to reward what I consider good, educational, and persuasive models of debate. This means your speaks will be low if you try and win on frivolous theory or short ""X is an independent voting issue"" and you'll get great speaks for smart affirmative cases or well thought-out negative strategies. Bonus points for not reading the same plan/DA/K/ etc as everyone else on the topic. Bonus data because I'm a nerd - looking at varsity rounds only I vote neg 52% of the time (a pretty minor bias given the sample size). Feel free to use this to answer bad (NEG SIDE BIAS JUSTIFIES XXXXX) arguments. Also in out rounds I squirrel 20% of the time. If you're interested in stats for your or a judge you know lmk. I have a python script that does it really fast.  ",2
"Generally looking for speaker/participants broader understanding of the topic and belief in the argument being presented.  Secondly, attentiveness to the opponents arguments, display the understanding and specifically counter those.  ",1
"I'm a former World Schools debater for Team Canada, currently an APDA and BP debater. I will prioritize well-warranted arguments over evidence, especially if such evidence does not actually support the logical conclusions teams are claiming they do (which is often the case). I also find theory annoying. Generally fine with most speaking speeds, but don't do anything outrageously fast. ",1
"Hi there! My name is Andrew, and I'm a current college senior. While in high school, I competed in Lincoln Douglas and Public Forum debate for Regis, but I haven't continued with debate since then (besides judging to help out my school when needed). When I debated, my partner and I were considered staunchly ""traditional"": We argued the resolution as it was written, spoke slowly, and engaged with our opponents' arguments directly. That's definitely the style of debate I prefer — that said, I understand that that's not necessarily the trajectory of the activity these days, and my experience in LD means I'll probably understand whatever you throw my direction. If you have any more specific questions, just ask me before the round! ",2
"I'm a flow judge and have debated 4 years of PF at Trinity School. Went to TOC '21. Defense is not sticky - if you want defense to flow through, you need to extend it in every speech. That said, if first summary extends defense that wasn't frontlined in second rebuttal, second summary is too late to bring up a new frontline. Screaming ""Smith 16"" is not an extension. If you want me to vote on something, you need to extend the warranting as well as the evidence. I don't flow cross - if something important is said during cross, make sure to bring it up in a later speech.  Talk as fast as you want as long as you're clear (but I find that when people talk fast, their warranting suffers; I will not vote off blippy warranting). No theory unless you actually, genuinely care about the issue (see TOC finals 2021 for a good example). Bonus points for any jokes made during speeches :) ",3
"Hey! The most important thing to know if you're going to be debating in my room is how much I value fair and thorough engagements! This looks like making concessions where necessary (when the arguments have been properly analyzed and are logical) and engaging in fair and charitable comparisons. Next up, don't be rude! Please respect your opponents. Thirdly, I am fully cognizant of the fact that speakers have a lot of material to cover in such a small time, but please make sure you don't excessively speed through those arguments! Speak fast, but don't zoom through your speech! Calm down and speak clearly so your opponents and I understand you. Finally, always be conscious of your burdens in the debate and do justice to them. Do not merely assert, justify those claims. Role fulfillment is a must-do! Good luck! ",1
"I'm a new parent/lay judge. Please do not spread. Speak slowly, focusing on clarity and quality of argument over quantity. Signpost when possible, and keep your delivery organized and oriented toward a first-time listener. Support assertions with evidence, taking care to place it in context and explain the relevance. Beyond making your case, please respond directly to your opponent's arguments. Highlight areas of contrast and points you believe are particularly favorable to your cause. Finally, present a clear summation of key points made (and not made), and why your side should prevail. ",1
"I have coached debate since 1971, beginning at Manchester (now Manchester Essex) from 1971-2005, and now at Waring School since 2005. I have coached national champions in both policy debate and public forum debate, so I can flow a debate. I am a ""tabula rasa"" judge, meaning that I believe that the debaters (and not my personal opinions or delivery preferences) will determine what issues and arguments should win the debate. I grew up in Kansas and debated for Topeka West High School (1962-65), where all judges were citizens of the host community. All of our debate was conducted in front of ""citizen judges."" That's what I believe is most important in PFD. The event was designed so that it would be persuasive to an intelligent and attentive member of the ""public."" For that reason, I feel that the delivery, argumentation, and ethos of the debaters should be directly accessible to such an audience. I do agree that dropped arguments are conceded in the debate and that NEW arguments in the final speeches should be ignored. I love it when debaters are directly responsive to the arguments of the other side, letting me know on a point by point basis where they are on the flow. I also honor those debaters who show courtesy to their opponents, who have a sense of humor, and who tell the truth about what they have said. I expect that all evidence will be ethically researched and presented in the debate. I will penalize (with points) any debaters who are sarcastic, demeaning of opponents, or biased in terms of race, religion, sexual orientation, or social class. I will always be happy to talk with you about any decision I make as well as to show you my flow and explain how I assessed the debate. I will do this AFTER I have submitted my ballot. In recent years, I have been spending more of my time in tab rooms than judging, but I truly enjoy the time I can spend in the back of the room. In these trying times, you debaters are our hope for the future, naming FACT-BASED arguments about important issues. Tim Averill (timaverill@comcast.net) 978-578-0540 ",2
"In judging public debates, I prioritize argumentation that has a solid reasoning in terms of answering the burden to proof of the assertion that is claimed. I weigh out the argument based on how it can persuade me through the comprehensiveness of the logical reasoning.  ",1
"I am a lay parent judge with no recent debate judging experience. Please be organized in your presentation -- I like solid arguments articulated clearly. Please don't talk too fast, mumble, speak softly, or do anything that would make it harder for me to follow -- give me a clear way to vote for you. I may ask for cards at the end. Be civil: if you use foul language, you will automatically get a 25 in Speaker Points. Be considerate: If you ask a question in crossfire, please allow your opponents to answer your questions. I need to hear two sides - it wouldn't be a debate otherwise. I look forward to hearing all of your presentations -- have fun! ",1
"I am a cardiologist in the Washington, DC area and I have no background in debate. I am a parent judge. I keep notes however I do not have any background on weird topics, nor do I know debate jargon. Please do not spread. Please speak at a normal pace. No yelling, basically just a conversational tone, if you don't your speaks will reflect this I will try not to vote off of cross but if you can’t defend case in cross/generally are not doing well in cross I will take off speaker points. I prefer off time road maps and please stick to them. If you don't I'll probably be confused. Be respectful to your opponents at all times. Let your opponents talk in cross please! Keep your arguments generally socially acceptable.  ",1
"BACKGROUND: I am a freshman at Harvard College who competed for Regis High School with moderate success (some bids, a lot of elims) in PF (and very infrequently in LD and Parli) for four years on the National Circuit. My email is tbarone@college.harvard.edu, but I value the integrity of my inbox and have no plans of looking at evidence unless told to, so I would rather not be on the email chain. CURRENT PARADIGM: I used to believe many of the things below, but I now tend to think that paradigms are dumb and advance a notion of debate that is overly restrictive and inaccessible to those with less experience/fewer resources. Feel free to read my former paradigm included below to understand how I used to think about debate, but honestly just debate how you debate, be kind, be honest, be clear, try to engage with one another in a way that is educational, and try not to do anything that I would likely view as excessively progressive, technical, or inaccessible based on the stuff below and the fact that my understanding of debate remains normed to what this activity looked like when I was introduced to it roughly 5 years ago. Also, please keep in mind that I don't do high school debate anymore (obviously), so my knowledge of the topic will usually be that of a reasonably well-read person and not much beyond + my ability to comprehend speed (especially if you don't enunciate!) is not what it once was. ______ FORMER PARADIGM: TLDR: I want a civil, unmuddled, honest, inoffensive, and accessible round with substantive weighing, persuasive warranting, and sufficient empirics to bear out the argumentation. Make your best effort to follow through on that wish and you're in good shape (but don't feel compelled to abandon your style in so doing; I will adapt as best I can)! Basic judging philosophy: I view flow norms of debate as useful and ascribe to them only insofar as they are most paradigmatically conducive to rigorous analysis and thorough argumentative engagement. Debate in whatever fashion you believe best meets those two criteria, but I believe that a warrant-focused debate with lots of good comparative analysis and an overarching narrative does so most effectively (and does not require superfluous speed or overuse of jargon). Long, non-exhaustive, and entirely unstructured set of preferences: Warrant warrant warrant. I couldn't care less about your evidence if it's not warranted. Tell me to call evidence and I will; misconstrue it and you're getting horrible speaks. Spewing debate jargon isn't a rhetorical technique. If it's misused or excessive it's reductive to the intellectual level of the round and it will guarantee you bad speaks. Weigh early, often, and in a way that interacts with your opponent's weighing. Saying buzz words like ""scope"" or ""magnitude"" isn't really compelling if I don't know how your arguments actually interact. Collapse on your best offense and build a coherent narrative that adequately frontlines major responses. Beyond being poor strategy that massively dilutes your weighing (I'm not going to think multiple pieces of offense important!), I think it's borderline abusive and torpedoes the overall quality of the round because it creates a super reductive burden on the other side to extend and implicate adequate responses for 2+ arguments. It's fine to read a lot of responses in rebuttal, but if they're not sufficiently explained/implicated or warrantless, I'm going to have trouble evaluating them even if they make it to the end of the round. In final focus and summary, try to collapse on just a few responses and implicate them well. I'm truly fine flowing fairly fast PF speech, but I will be very annoyed if you don't enunciate and signpost well in so doing. If you're going to run a turn, please implicate the overall effect thereof. So many people read a ""turn"" that actually just recognizes one negative effect of something and concludes that it must therefore be net negative. Effects are almost always multidirectional, so, unless you're implicating why something is net your way, I'm probably going to presume that the net effect is whatever the original offense was, or I'll at least avoid voting on the issue. Regardless, unless the turn is well weighed and impacted, I'm really not inclined to vote for it. In second rebuttal, ideally frontline everything you're going to go for in the back-half speeches. I think it's problematic to only respond to turns in second rebuttal because that leaves first final focus responding anew, which I think creates an unfavorable time skew. I understand this puts pressure on second rebuttal, but you can deal with that by collapsing early (which I would actually appreciate regardless--it makes the weighing nicer). That being said, I won't regard defense as conceded if not frontlined in second rebuttal, I'll probably just dock speaks (note: turns DO need to be frontlined in second rebuttal). Both summaries need to have defense, offense, and weighing (definitely with a focus on the latter two). If you read off of your computer for the entire round from prewritten text, you're getting very low speaks because that isn't what debate is. If you say something was conceded, it better be conceded. Probably my biggest pet peeve in debate is when people say a very clearly responded-to argument was dropped, and I will definitely drop speaks substantially for doing so. You will lose the round with awful speaks if you run arguments that are inaccessible or argue in an inaccessible way (theory, Ks, spreading, anything from LD/policy). The only theory I'd even consider evaluating would be in response to a genuinely very abusive in-round strategy (examples include: spreading, second rebuttal disads, absurd response dumping, turn dumping). I will be so mad if your style of argumentation is about muddling up the round with high volumes of non-responsive information. I am the weakest possible version of tech over truth. The only time I'll vote on a flagrantly untrue argument is if it's totally conceded. While I think good critical-thinkers should always be able to deal with outrageous arguments, running them wastes a team's time, throws them off, and is rarely intellectually honest. If you run disads, I literally might just not evaluate them because I think they're so abusive (in second rebuttal, I absolutely won't). If you run a disad and call it a turn, I'll be furious (an M4A example: neg differential pricing is not a turn on aff access). In general, I tend to think that a super turn-heavy strategy by the first-speaking team fringes on abusive and is really reductive to the intellectual quality of the round, so, while I won't intervene because of it, I will a) have a lower standard for how much frontlining needs to be done in second rebuttal and b) have a higher standard for the quality of the extension/weighing of the turn. ",2
"I debated in high school LD and PF and am a college Parli debater, so I have a good amount of experience. I was a quarter finalist in CA for LD and the highest ranked debater in my league (if that matters).  LD is first and foremost a value debate. Be sure to keep that in mind. - Be cordial to each other. There is no reason to be rude to your fellow competitors. - Time yourselves and each other, please. - I am fine with speed, but I do not like spreading. - Sign posting is extremely important to me. - It’s extremely important that you show a good understanding of the topic and you are not simply throwing out arguments that you think fit and reiterating them. - While I am more of a traditional judge, I am open to progressive debate (K, T, Theory, ect.) but give substantial explanation. - I love clash. Be sure to actually respond to your opponents arguments rather than just say they don't matter. ",2
