Paradigms,JudgingType
"Hi! I am a third-year debater so I like to think I’m a flow judge but honestly, I might have a mid-round identity crisis and just become a lay judge. (proceed with caution) Please time yourselves. Speaking of time, it’s time for my daily rant on cards in debate...I don't care about where you got your evidence from because you can find someone on the internet to say anything. I prefer logically warranted arguments, so don't have a card-heavy summary. Along with this, saying that someone misconstrued their evidence is not enough to rebut their point. I will still flow it through if they can give a logical explanation for why something would happen. Also, I would prefer paraphrasing for card extensions in latter half speeches (just don’t repeat the words of the Brookings Institute. I know, I know, we all love the Brookings Institute so this might hurt at first but I’m sure you can manage, as I have gone 2 years without having a card that wasn’t misconstrued in one way or another by my own paraphrasing). Okayyy rant over, now more basic stuff. I don't flow cross but I will be listening. Don't be mean, please frontline in second rebuttal. To win the round, you have to weigh. Saying buzzwords is not weighing if you don't warrant it. Tell me why you have won the round and why your impacts or link strength are better than your opponents’. That's all. If you have any questions feel free to ask me in round. ",2
"Hiii, I'm Rozey and I am currently in APDA at Wellesley College but I truly appreciate all debate styles & their quirks! I have experience judging in APDA, PF, and Congress. That being said please feel free to message me for feedback or for absolutely anything! :~) More on Experience I have debated and judged on the APDA team at Wellesley College for two years. Alongside this, I have judged multiple in-person and online tournaments in the APDA, Public Forum, Congress, and Lincoln-Douglas styles. I also judge through Hired Judge & have additional experience through that platform. Speed Please, please take into account that I don't appreciate speed, I can flow it but! I would much rather completely hear and process the entirety of your argument rather than only capturing a few points. Weighing Hot tip: weigh! Weighing is so helpful for me as a judge in evaluating because this the point of the debate, to show which side of the debate/house is going to have the most impact. I can assure that someone who weighs, especially in their closing, is going to receive higher speaks simply because I understand their argument. Also, provide me with some ~spice~ in your speeches! A little humor never hurt anyone! ",2
"Parent judge here. Lay judge. Speak slowly and clearly--I would prefer good presentation as well. Just be persuasive. Signpost--It makes it easier to follow. Logical arguments--these make a lot more sense than a big card dump, and I'm more likely to understand it. Weigh--makes it clear to me who's winning Don't be rude or offensive. ",1
"Put me on the email chain chodgson8797@bths.edu (I'm only paying attention to what you read this is simply for reference at the end of the round and to make sure emails are sent somewhat promptly) I do flow cross ex/crossfire but it must be in a speech if you want it voted on. I do believe cross is binding. Background: I've done policy debate for years @Brooklyn Tech and I've judged Policy, PF, and Parli rounds before. I've run afropess, cap k, policy args, a decent amount of theory and have debated nearly every other mainstream arg (haven't hit death good, but I have read a bit). Having said that I'm fine with spreading just be clear, understand that virtual spreading is iffy if there's lag, and respectful of your opposition. I don't care about formal attire and don't take points for wearing sweats. My pronouns are she/her. If there are blatantly racist, ableist, sexist, homophobic, transphobic arguments or statements and the opposition points it out and tells me its bad in any way and I agree you will lose (this is rather strict for example ""black people are criminals"" will have you voted down ""stats show that black people in the US have higher arrest rates"" will not, notice the difference even if I personally believe both are bad I will only vote down the former). Top Line: I'll vote for wtvr. That includes T, DAs (with impacts but hopefully you know that), Kritiks, Counter Plans, and theory. I know people are iffy on theory but I personally feel they make some of the best rounds. Credits to William Cheung for the rest of the this1) Have a claim, warrant, and impact to every argument. It isn’t an argument absent these three elements, and I will have trouble/not be able to/want to adjudicate what you’ve said.2) Make sure, on that note to properly explain your positions, don’t make an assumption that I know your DA scenario (perhaps fill me in on the internal work), or K jargon. Maybe i haven't judged that many rounds this topic and don't understand abbreviations right away - help me out. 3) Have comparative analysis of evidence, arguments, and preformative styles as it compares to your own and how I ought to prioritize impacts as it relates to your framing of the round. 4) Be Persuasive, it will go a long way to making me to sign my ballot your way if you can make the round enjoyable, touching, funny, etc – it will also help your speaks. 5) Write the ballot for me in your last speech , tell me how you win. Take risks, and don’t go for everything. Make me think, “woah, cool, gonna vote on that” “What they said in the last rebuttal was exactly how I prioritized stuff too, judging is soooo easy [it's often not :(]"" Also, some other things:1) I will default to competing interpretations on T and extinction unless alternative mechanisms of evaluating the round or alternative impacts are introduced and analyzed.2) I will avoid looking at evidence, unless there is a dispute over evidence in a round or a debater spins it as part of being persuasive 3) Extend arguments if you want them to be voted on and no new args in the final speeches4) I am an open minded judge, and respect all “realms” of debate, though of course, I will always already have some bias (I fully admit I am a K debater, although I do usually take FW and T on both sides), I will do my best to mitigate it. ",2
"First-year international student. Former World Schools debater, current parli debater. 1. Warranting > evidence. I will not vote on unwarranted evidence. 2. Please no spreading. I will not be able to follow spitfire speed. 3. Be realistic with impacts. If the impact of the case is nuclear war but it has zero plausibility, it's really hard to vote on it. 4. Weigh your arguments. Multiple things in a round can be true, but they are probably not all equally important. 5. I don't understand theory, so if you use it, I might get lost. 6. Please be courteous and respectful to your fellow debaters! ",2
"Harvard Tournament - *I'll be in Tab - Don't waste a strike on me* I have been coaching public forum at Shrewsbury High (MA) since 2014. I have a lot of experience judging, but have also been in the tabroom a lot recently. I believe in the values of public forum debate, meaning that the debate should be able to be adjudicated by a citizen judge. I will flow, but I'm looking for clear signposting and a clear structure to each speech. This is just good practice. I love a good narrative, but not at the expense of solid evidence and impacts. I want logically sound warrants, please don't just say that my card is from 2020 when theirs is from 2019...I want a real reason for why your evidence is better in relation to your contentions. Please give me clash and weighable impacts. But please don't just say you outweigh on scope or magnitude without telling me why. I really don't want to call for evidence, so please don't use false figures or try anything dodgy. This includes things like, ""our opponents didn't respond..."" when they clearly did respond. I will not judge based on any plans, counterplans or critical theories. That is simply not in the spirit of public forum debate. I don't like roadmaps. Your speech should be clear enough for me to follow without one and it's a problem if you need one, and although I'll probably let you give it, I won't be listening to it. Don't be rude. This includes good etiquette in crossfire. Condescension will make me look for a way to give you the loss. I do really like cases I haven't heard before. Just be careful though, the reason they're new is that there's usually an issue with them! That's the fun of all this right!? ",2
"Parent judge with little judging experience, please don't spread and don't exaggerate on impacts :) ",1
I am blank slate. tabula rasa. What I hear is how I judge.  I want to understand you while speaking (I’m in sales) and I want you to debate each other for the topics presented in the round.  I will not read any files unless there is a clear distinction of misunderstanding.  ,3
"Hello, I did pubic forum debate for 4 years at Lincoln Sudbury High School. I am now a thirrd year student at NYU who has judged at a some over the past few years tournaments. I have a very standard circuit pf paradigm (if you don't know what that means, ask). I don't mind some speed as long as it is clear. Please ask me any other questions before the round. Please have a fun and relaxed round, thank you! I usually won't know the topic well so make sure to explain anything topic specific but I would like to think I have a pretty decent understanding of international politics and basic, debate relevant, economics. Keep track of your own prep time and if you care, your opponents prep time, because I will not be timing either. If you are gonna run theory or Ks, ask your opponent before the round if they are ok with it. I don't really like those argument styles but I'll vote for them if they are cleanly won. :) My email is bsh298@nyu.edu if there is any questions after a round or anything else (hopefully no death threats). ",2
"I am a parent judge with limited previous judging experience. My preferred rate of delivery is a 2-3 out of 5. If you are unclear, I will not flow your arguments even if they are true. This helps me understand your arguments and better allow me to evaluate the round. Substance debate and contention level debate under the resolution is most important. Framework is important as well, but you should make the best argument as I will vote for the most persuasive speaker. It is very important to have strong evidence to back up your claims. If you make assertions without good authors/sources/credentials to support your position, that is not a strong case. It is recommended that you include voting issues at the end of the round that crystallize your position and your speech so that I, as the judge, know what to vote on and who to vote for. ",1
"-Paradigm for Ash- updated February 18th, 2022  -Background- As a competitive debater, judge and coach of 8 years, I have experience with: British Parliamentary, Canadian Parliamentary, Australian Parliamentary, Public Forum, World Schools. I prioritize c",2
"Hey guys! Really excited to be judging you this round. I have a background in debating American/British Parliamentary and Extemp Policy, and I've coached World Schools and Public Forum extensively. A few brief things to know about my judging style: 1. I'm okay with people speaking moderately quickly, meaning 1.5-2x conversational speed. If you are spreading too quickly for me to flow, I will use the policy norm of saying ""clear"" and expect you to slow down after that. 2. Weigh. Impact. Otherwise, I will evaluate the importance of your arguments for you, and 50% of the time it won't be in the way you want me to. 3. Even if you're in a research-based format, give some logic to back up your evidence. You will not win based on a single, unsupported statistic or quote from some old guy. 4. All POIs/crossfire must be incorporated into later speeches in order for me to count it as substantive. Explain to me why the answer you got from your opponents matters in the context of the round. 5. I do not vote off of theory. The one exception to this is trigger warning theory. Include a content warning if you are going to discuss distressing topics (e.g. sexual violence). Harvard 2022 Update: I used to tell debaters that I liked KitKats so they could gain my favor. Due to the inability to deliver snacks online, I'll mention instead that I'll like you infinitely more if you mention Bulgaria in your speech :) ",2
"This is my first time judging any tournament and my first time encountering public forum debate. First and foremost, although I have been speaking english for years, it is my second language so please speak SLOWLY––I cannot emphasize that enough. Slow. Secondly, just assume I know nothing about the topic and explain your arguments thoroughly. Doing these two points will only help me understand your arguments better, which makes it more likely I'll vote for you. I recommend you collapse your arguments so you have time to explain them and make it really clear why they're most important. Please avoid debate jargon because chances are I'm not going to know what you mean. And finally, please be polite and respectful to your opponents and remember to have fun!  ",1
"I am aflay judge. I usually vote off of logical arguments with solid evidence and weighing.  I am a linguist by training so your language of debate matters to me. I like clear and comprehensible speeches, meaning you might have to slow down a bit (I'll give extra speaker points to those speakers)  I also care about being courteous and professional during your debate, meaning I would never vote for those who are too aggressive and rude.  ",2
"*paradigm finessed from Ryan Zhu* - PF debater from Edina JW, have competed nationally and locally. If you wish to have any accommodations to make the debate safer/better or have any extra questions after reading the paradigm, contact me on Facebook Messenger or at evanjiang943@gmail.com put me on the email chain if there is one: (email above) tl:dr - tech > truth judge - tabula rasa. I'll flow the entire round, debate how you want - line by line/big picture idc. Everything in FF should be in summary. - ay have fun! crack jokes - itll make the whole debate more fun and enjoyable - i'll disclose the decision - if you think i messed up, roast me all you want, post round me, ask questions, idrc but don't be a dick. speed: i can keep up and flow anywhere up to 300wpm. send a speech doc to me if you're gonna spread and make sure you aren't excluding your opponents. weighing: pls pls weigh! weighing is the easiest way to win the round and structures how i view the debate. GIVE ME A REASON WHY TO PREFER YOUR ARGUMENT/LINK/IMPACT OVER YOUR OPPONENTS. second rebuttal: second rebuttal should frontline at the least turns, but prolly defense also. split however you want (ie 2/2 or 3/1). first summary: unfrontlined defense is sticky for first summary and can go from rebuttal to final focus. if it is frontlined, still need to extend it. turns should always be in summary. theory: i'm good with most theory arguments as long as there is a real violation, like the other team not reading a content warning for a potentially triggering argument. i'm not gonna vote on friv theory (shoe theory, disclosure, paraphrase) tbh. paragraph theory is fine if you don't know how to write the full shell. Ks: these are prolly fine if you want to run the argument, but slow down and explain it rly well. i won't know the lit base but I'll listen to the arg and know how they work. tricks: no. speaks: Average ~ 28.5 and go up/down the 0.1 scale from that. strategic decisions and collapsing earn a bump. i'm not gonna evaluate 30s theory tho. evidence: cut cards are a must - whether you read those cut cards verbatim or paraphrase them is up to you. If anyone calls for ev, pls be able to give them the card promptly. don't do these: If you make an offensive comment (ex: racist, sexist, homophobic, etc.), you will get the L and lowest possible speaks. Debate should be inclusive and safe for people. offensive overviews: don't pull out a new contention in rebuttal, i'm not going to vote for an unrelated DA out of second rebuttal, and i don't think that reading a new contention level arg in first rebuttal is strategic. dumping unwarranted args: don't read as many arguments as you can if it means sacrificing the warranting and explanation. that being said, i'm fine with any crazy arguments as long as there are warrants and implications. quality > quantity plz. ",3
"Hi y'all! I'm a second-year out who debated (well tried to) at Newton South for four years. I'm flow enough, but extremely high speed or techiness is past my pay grade. ""Uniqueness determines the direction of a link"" or something is a term I never got while debating, and you'd have to really explain it to me now. New arguments will be thrown out in summary and any new points are thrown out in final focus (if you're the other team, please shake your head vigorously and look incredulous to help me notice that it's new). If some evidence is wack, let me know and I'll look at it. Bad evidence may drop speaks and make me throw out the point. Uncontested defense flows through first summary. I've forgotten all the other rules of PF, so if you want any clarification just ask. Please signpost! I've realized that in my old age my listening comprehension has deteriorated. Without really clear signposting any kind of speed is wasted on me. Please weigh! But good weighing. It needs to be warranted, it's better if it's comparative, and I would appreciate link weighing as well. If both sides weigh but don't say why your weighing analysis is better, we're back to square one. This is a really easy way to win the round. Without weighing, I prioritize links over impacts. Calmness: this is a really fun tournament! Enjoying the act of debating is hard when things get tense, but it makes everyone's day better. Ask actual questions in cross! I usually don't evaluate cross, but I will poorly evaluate ""I'm right, do you agree"" or ""You're wrong, do you have a response?"" It's really important to read paradigms so I'll give you 0.5 speaker points just by telling me you read my paradigm. Good luck! ",2
"Used to do PF in high school, I now judge and coach sometimes.  Standard tabula rasa judge Strategy and analysis are the most important factors for me: Please do comparative weighing and explanations between your arguments and your opponents - this is where I end up voting 90% of the time.  If you have any questions about my judging preferences or requests to make the round more accessible, please reach out to me on Facebook. Thanks and I look forward to judging you! ",2
"Hi! I’m writing this for my dad (who doesn’t believe in paradigms). A couple things you should know: He’s a parent. Treat him as such; you know what to do. He’s a professor who gets paid to evaluate students. You’re debating in front of someone who definitely can tell a good and bad link chain apart. He says he understands speaking quickly. However, he doesn’t think that fast speech is persuasive. I wouldn’t go fast, and definitely not spread. He doesn’t know any debate jargon. Use at your own risk. He is a historian, and knows a lot of history. Same for public health -- be careful that what you run would be accepted by an academic in the field. Be polite & fairly formal. He just spent 15 minutes complaining to me about informal paradigms. He wants debate to be fun. I'd recommend smiling. He doesn't believe in off-time road maps. He says that he has never seen them in the rulebooks, and that debaters simply say ""first I will rebut the opponent's case, then I will make our case"" -- which isn't either surprising or helpful. Overall, debate like you would in front of a teacher ready to edit your case. Good luck and good debating! ",1
I am a veteran teacher that loves vigorous debate and discussions. I prefer students to engage the topic with insightful and meaningful arguments. Be kind in the debate to the other students and make sure to respond to arguments made by your opponents. Don't spread - I prefer conversation speed. If you go faster than that then you do so at your own risks. Be firm and aggressive but not rude - I enjoy a heated debate but not mean and rude comments or disrespectfulness during speeches. I wouldn't consider myself to be a specialized debate judge so if you use a bunch of debate jargon that may not work out well for you. If you have questions feel free to ask. Good luck! ,1
"Hey, I am relatively new to judging. Please speak at a normal pace, I cannot keep up with people who speak too fast. Good luck :) ",1
"I am a lay judge and this is my first year of judging. I flow the rounds, and I generally have some background knowledge on the topic, but please treat the round as if I do not because I may not know what you are talking about. What I look for in a round regarding any debate style: Speaking Speed: Please go at a moderate speed. I don’t want to have to judge a round where I am barely able to flow because of the speed the round is going at. I also want to make sure that both I and your opponents are able to understand your contentions. It’s very time-consuming in crossfires to ask for a summary of your contention(s). Timing: Please make good use of your time. I would appreciate it if you time yourself. I will be timing, but I think as debaters you need to develop the habit of timing yourself. Attitude: Please be respectful. I will not tolerate inappropriate language, interruptions, etc., and it would be in your best interest to avoid this. I will dock speaker points if anyone is rude. Crossfires: In your crossfires, allow your opponents to respond completely and don’t interrupt anyone. Also, please have your cards handy in case your opponents call for a card. It would save a lot of time. Cherry Picking: Please don’t take a single example and generalize it to the overarching idea. I’ve judged rounds where debaters have done this - for instance, on the PF NSA surveillance topic the privacy vs. security argument - and it’s very messy and hard to judge. Prep Time: Please don’t take any prep time before your crossfires. I’ll be glad to give it to you any other time, like before rebuttal, summary speech, etc., but I discourage taking any before a crossfire. I am okay with taking either running or set prep. Technical Difficulties: I like starting as soon as possible, and it would be greatly appreciated if you can resolve any tech issues with your partner/on your own before entering a round. Speaker Points: I’ll be basing your speaker points on your speed, style, timing, attitude, crossfires, and, of course, the actual content of your speeches. Clarify any questions you have for me beforehand. I look forward to judging a clean and interesting round. ",1
