Paradigms,JudgingType
"email me for questions/add me to the chain: tara.gill.527@gmail.com tl;dr: Me: ""Do you know why I'm such a laid-back judge?"" Y'all: ""Why?"" Me: ""I go with the flow"" (creds to @Debate Memes on Facebook haha) - yes I will vote off the flow - warrant, extend your full link story and impact, and weigh and you're doing really well - things you want me to vote on have to be in every speech after first rebuttal - I want the round to be chill and educational and fun so please make that happen quick disclaimers 1. i'm now old and grumpy and care a bit less about debate than i used to so please don't assume i have extensive topic knowledge 2. January 2022 i hate this topic so much i'm down to judge a crypto debate or any other topic both teams agree on. if y'all want to debate this topic it's okay i won't be too mad :) novices: it's so cool that you're trying out this activity even though it's probably kind of scary. If you don't understand some of my preferences in the long version, the tl;dr should be fine. Just know that you're probably doing great and that you got this :) feel free to ask me any questions before/after the round. Longer Version: hi! I did 2 years of Public Forum at Lexington but I started out my debate career in policy which influences how I judge! - i'm more tech than the average tech judge so please clash to avoid judge intervention, or at the very least weigh a lot on both link and impact levels :) - in later speeches, please give quick narrative style overviews at the top of your own case then frontline/line by line (i still don't know what frontline means but just don't drop stuff) if u want me to vote on your contentions otherwise dropped defense will mitigate your impacts. this also means u should frontline in second rebuttal and extend defense in first summary. - i will vote off most arguments including theory/k if they are debated well (my threshold for these being run well is pretty high lmao so try at your risk ig) and not used just to be exclusionary (check the bottom of my paradigm lol) - do a lot of weighing/impact calc and logical analysis (not just for me, it is also strategic if you're lost/confused and I would know first hand oops) - once again please weigh weigh weigh. really make the force of gravity a lot here (i'm sorry i'm a physics nerd) - start collapsing in first summary because depth>breadth in terms of giving quality arguments in short PF speech times - crossfire shouldn't be three minutes of extra debating please ask and answer questions in a non-aggressive and CIVIL manner or I will be frustrated, get a headache and probably dock speaks. - if you want to take off a jacket or shoes in round feel free to do so because i almost never debate with shoes. this will not affect speaks or the result :) - feel free to ask me questions about my decision if you're confused, I will not dock speaks and I feel like it usually helps you learn how you can improve in the future, and there is a non-zero probability I am wrong (but low probability) - i am fine w speed if you do all of the following: prioritize clarity, make sure your opponents are ok too, slow down on tags, authors, and analytics, signpost clearly, offer speech docs if necessary - lastly, debate is a game: this means that you should not be exclusionary, follow the rules or warrant why you shouldn't, and let me know if there is anything I can personally do to make the debate more accessible to you, and HAVE FUN!!!!! Extra: - fist-bump instead of shaking hands haha - I'll default to a slightly above a 28 if it's by 0.1 and 28.5 if it's by 0.5 - i am also happy to talk after round, show you my flows, and answer questions about either debate or life :) ",2
"I coach for the College Preparatory School. I debated for two years for Bethesda-Chevy Chase HS. In my senior year I won Glenbrooks, the Strake Round Robin, Blake, Durham, the Barkley Forum, Stanford, Harvard, the King Round Robin, and NDCAs. Add eli.glickman@berkeley.edu AND collegeprepdocs@gmail.com to the email chain. Please label email chains properly. Ex. ""TOC R1 F1 Email Chain Bethesda-Chevy Chase GT v. AandM Consolidated DS."" UPDATE FOR THE REST OF THE SEASON: I will be requiring all debaters to send the cut cards and paraphrased versions (if they exist) of their constructive speeches in the email chain before the speech in which they are read. That means case and rebuttal. TL;DR Tech>truth. Weigh, give me good warranting, and speak as fast as you want. Defense is sticky; first FF may read some new weighing (NOT elaborate weighing… no overviews, prereq analysis, etc.). Extend your arguments with card names, warrants, links, and impacts in the back half. Weigh links and turns, defense, and pretty much everything else. Please read the evidence section of my paradigm and abide by those rules, they will be enforced. DEBATE IS A GAME, PLAY TO WIN. Tech>truth. I will vote for pretty much any argument as long as it's warranted well and it's not racist, antisemitic, sexist, homophobic, etc. I have experience with traditional and progressive. I will vote on the flow. How I Judge: If my paradigm is unclear, my favorite judges were Will Sjostrom, Chad Meadows and Marcus Ellinas; anything PF-specific in their paradigms should give you a fairly good idea of how I hope to evaluate the round. ———PART I: SPEECHES——— Signposting: This is essential; do it. Cross: I might listen but I won't vote off or remember anything said here unless it's in a speech. Don't be rude. Feel free to skip GCX if everyone agrees—both teams get 1min of prep. Rebuttal: Read as much offense/DAs as you want, just please implicate them on the line-by-line and weigh them. Second rebuttal MUST frontline terminal defense and turns, probably some defense too, but blippy NLs from the first rebuttal don't all need to be answered here. Summary: First summary only needs to extend turns but should also extend terminal defense if you have time. Defense is sticky, however, I’d prefer for the second summary to extend as much defense as possible. The only new turns or defense I’ll evaluate in summary are as responsive to new implications made by the other team. Final Focus: First final can do new weighing but no new implications of turns, or anything else UNLESS responding to new implications or turns from the second summary. Second final cannot do new weighing or new implications. Final focus is a really good time to slow down, treat me like a flay judge in these speeches and my decision becomes a lot easier. ———PART II: TECHNICAL STUFF——— DO NOT SAY 'DELINK,' SAY 'NO LINK.' Voting: I default to util. If there's no offense I presume to the first speaking team. I will always disclose after the round. I can also disclose speaks if you ask. Evidence: —Evidence §1— I will not accept paraphrased evidence. I treat paraphrased cards as equal in link strength to analytics. (You can make a theory argument as to why I shouldn't). If there are two pieces of competing evidence that will determine the round and both teams want me to look at it... I will almost always err on the side of the non-paraphrased evidence. Whether or not you paraphrase, YOU MUST have cut cards, if you don't I will cap your speaks at 27 and you should strike me (27 speaks cap does not apply for MSPF, NPF or JVPF). —Evidence §2— When evidence is called for, take less than 2 minutes to pull up the cards or it comes out of your prep. —Evidence §3— If you misconstrue evidence—you know who you are—and I find out, I will either drop you or give you the lowest possible speaks, depending on the severity of the misconstruction (I am more than willing to assign an L20 or below). If you catch your opponents misconstruing evidence, call it an independent voting issue (IVI) and I will treat this as a pre-fiat round-ending argument if the evidence is sufficiently misconstrued. Email Chains: Please label email chains adequately. Ex. ""TOC R1F1 Email Chain Bethesda-Chevy Chase GT v. AandM Consolidated DS."" Whether or not the tournament is online I will require an email chain for every round, evidence exchange is faster and more efficient. If you are spreading or reading any progressive argument you must send a doc before you begin; otherwise, sending a doc will not be required. Prep Time: Don't steal prep or I will steal your speaks. Feel free to take prep whenever, flex prep is fine too. Speech Times: These are non-negotiable. I stop flowing after the time ends, and I reserve the right to scream ""TIME"" if you begin to go over. Cross ends at 3 minutes sharp, if you’re in the middle of a sentence, finish it quickly. Speed: I can follow speed (300wpm+) but be clear, if I can't understand what you're saying that means I can't flow it. I'd like a speech doc if you're going to go over 275 words per minute. Speed is good in the first half and bad in the second half, collapse strategically; don't go for everything. If you spread (300+ wpm) paraphrased cards there is no way you get above 27 speaks. If I miss something in summary or final focus because you're going too fast and I drop you it's your fault; slow down, don't go for everything, and be efficient. Disclosure: If you've disclosed on the NDCA PF wiki properly I will give you +0.5 speaks, there's no punishment for not disclosing. Let me know if you are disclosed before the round so I can boost your speaks. (How to disclose.) Disclosure should include round reports and open source documents (I believe that disclosing highlights is bad, I will not increase speaks or look more favorably on highlights having been disclosed). Speaks: Clarity and strategy determine your speaks. I disclose speaks as well, just ask. Postrounding: Postround as hard as you want, I think it's educational. Before you start make sure I've submitted your speaks. Trigger Warnings: I do not require trigger warnings. I will not reward including them, nor will I penalize the absence of them. This is informed by my personal views on trigger warnings (see J. Haidt and G. Lukianoff, The Coddling of the American Mind) This means that I will never opt out of an argument. I will not hack for trigger warning good theory; I am open to trigger warning bad arguments (though I will not hack for these either). ———PART III: PROGRESSIVE DEBATE——— I enjoy theory debate; I ran theory frequently. You do not need to ask your opponent if they are comfortable with theory; 'I don't know how to respond' is not a sufficient response. To quote my partner Roy Tiefer, ""don't put your kids in varsity if they cannot handle varsity arguments"" (saying that is terminal defense against any 'idk how to respond' argument and will result in a 30 for whoever says it). Preferences: Theory/T - 1 LARP - 1 Kritik - 3 Tricks - 3 High Theory - 4 Non-T Kritik - 5 (Strike) Performance - 5 (Strike) Theory: Yes, I think paraphrasing is bad and disclosure is good. No, I will not hack for either of these shells. I really like theory. I think frivolous theory is bad but I'll evaluate it; I have a lower threshold for responses the more frivolous the shell. Poorly executed theory will result in low speaks. If you've never run theory before, and feel inclined to do so, I'm happy to give comments and help as much as I can. I default to competing interps and no RVIs. I believe that winning no RVIs applies to the entire theory layer unless your warrants are specific to a shell, C/I, etc. Non-friv theory should be a zero risk issue to check abuse, I will still vote for RVIs if you win them. Unless I am evaluating the theory debate on reasonability you must read a counterinterp... if you do not all of your responses are inherently defensive because your opponents are the only team providing me with a 'good' model of debate. Theory should be read immediately after the violation. Eg. if you're speaking first disclosure must be in your constructive for me to evaluate it. However, I am willing to vote off of paraphrasing theory read after rebuttal if your interpretation is that people shouldn't paraphrase in rebuttal. You MUST need to extend your own shell in rebuttal if it was read in 1st constructive; you must frontline your opponent's shell in the speech after it was read (unless there is a theoretical justification for not doing this). Kritiks: I have run Ks a few times, however, I am not the best judge for these rounds. I'm more familiar with biopower, security, cap, and imperialism than anything else. You can run high theory Ks just explain them well, I've read some of the literature in school. Tricks: These are pretty stupid but go for them if you want to. Everything Else: Framework, soft-left Ks, CPs, and DAs are fine. TKO: If your opponent has no path to the ballot (conceded theory shell or them reading a counterinterp that they do not meet themselves) invoke a TKO and you win with 30 speaks (unless you have violated any previous clauses related to speaker points), if they did have a path to the ballot you lose with 21s. ",3
"No Debate. Firstly, If both teams agree, give me a paradigm that you like better and I'll judge based on it (this includes not flowing/being a lay judge lol I am g-d tier mom judge and won't intervene) Here is how you should read my paradigm: at the top of each section is the most important stuff. If you only have a few mins read that. reading below those parts will provide a more in-depth take into my judging philosophy. Update for Online Tourneys I rlly can't follow like REAL spreading but I can take 99% of PF speed. I'll clear u if i need it. also ask questions if u have them and I'll answer as honestly as possible! Most important part of my paradigm: If you make or buy me a chicken parm or mac and cheese, I will get you prep on a topic or coach you for a round or something. I rlly like chicken parm and mac and cheese.... My name is Sam and I debated PF at Wayland High School in Wayland, MA. Was a meh first speaker and got carried imo. Now I'm a member of the Barkley Forum at Emory University in Atlanta. TLDR: Normal circuit tech judge who likes warrants and logic and needs you to collapse on args Feel free to ask any questions about my paradigm before round or my RFD after round. (thx @Kate Selig for this idea: I'd rather you postround me than tell everyone I'm a bad judge ) Also, ask questions before the round starts! I might have thoughts on the topic you'll wanna hear. tbh also might not cuz I'm kinda dumb Speed: u can go fast, but don't like SPREAD SPREAD plz plz. i will try to keep up and clear u if need be. I can flow it but only if you articulate well enough. 300 wpm and up I need a speech doc. The faster you go the more work I have to do and I'm lazy. I will always flow ur speed, but chances are if you feel the need to go too fast, then your time allocation was bad/you made bad strategic decisions. Also like fr just cuz u can go fast doesn't mean u should. Speed kills Theory/Progressive args: read whatever you want. i ran a cap k during medicare for all and loved it lol. I'd rather you not read random theory args just bc you want to win. if you're doing that, ASK YOUR OPPONENTS/DISCLOSE BEFORE ROUND. its rlly shitty if you don't. i can't emphasize it enough, reading theory on novices or people that don't understand what's going on = :( If it's warranted and weighed I'll vote off of it. the below is borrowed from Jason Luo's paradigm d-d-d-d-disclosure theory - win the flow, win the round. i am very (like actually completely 50-50) tab ras about disclosure, i do not think it is good or bad, just that it exists. p-p-p-p-paraphrase theory - win the flow, win the round. i am very slightly biased (55-45) for paraphrasing good but its not hard to win paraphrasing bad. all other theory/k stuff: if it's warranted and weighed I'll vote off of it. Cross: it doesn't matter Its useless to me. If you want to use an answer your opponent gives in cross, then say it in a speech. Don't be rude. Hug your opponent for a 30. If your partner roasts their opponent in cross (without being douchey) you are expected to stand up and yell ""WORLD STAR!."" If you do so and I find the roast amusing then you and your partner each get 30's. If you misjudge a roast and I think it's lame you get 26's for interrupting cross. Framework: I default util. Explain it well and how I'm supposed to evaluate offense under it. the more complex, the more explaining u need. Framework debates aren't my absolute favorite but hey, you do you!! Evidence disputes: read ev if u want. don't miscut but i won't drop u for it. I value all evidence equally unless you weigh it, which you should. You should ALWAYS tell me why I need to value your evidence more. also, evidence doesn't matter nearly as much as logical warranting. also like in general i won't call for cards unless ur like ""sam call for this card"" in speech. I think that calling for ev in any other circumstance is intervening. Speaker Points: strategy + speak pretty to get good speaks You will get better speaks if: You make jokes. You give good speeches and make good strategic decisions. You aren't a dick. You make me laugh. I am extremely generous and tend to give out 29's routinely. I will give you a 30 if you are exceptional. *Send me a speech doc for an extra .3 speaks (sgoldstone514@gmail.com). Also extra .3 speaks for collapsing (if u do it correctly and it makes me happy) in 2nd rebutal. I guess I'm receptive to 30s theory but like it shouldn't be hard to get a 29.5 from me. I good example of really good strategy is what Jason Luo did in first final focus of TOC finals. also i will give speaks relative to the round and the level of competitors in the debate. Here is an itemized list of my favorite speakers in no particular order: - Rahul Shah (his voice is soothing and he's so damn cute) - Claudia Leduc (gives summary without looking at the flow at all, hella impressive) - Atharva Weling (sounds so persuasive) Rebuttal: collapse in 2nd rebuttal. at least frontline offense and stuff. anything not frontlined is conceded. Summary + FF: Collapse, extend full link chain, weigh I like roadmaps. I don't need defense in first summary. Don't extend too much in Summary, thats my biggest pet peeve FOR JESUS' (or any g-d u may or may not believe in, but if u wanna win the round do this lol) SAKE: COLLAPSE. When extending the argument you're going for, please extend the uniqueness, link, and impact in both speeches. An incomplete/ghost extension would a) make me sad and b) possibly lose you the round. Please impact out turns in summary (although its better if this is done in rebuttal) if you plan on going for them. It is 100% okay to just go for a dropped turn. Also, u can go either line by line or give voters/do what you usually do. Don't extend through ink lol. Defense isn't rlly sticky it (unless u make an arg that it is in speech) but I'm less inclined to vote for a team that doesn't frontline at all even if their opponents don't extend defense. Weighing: Please weigh, and give me good analysis. It makes my job 1000x easier. Earlier you weigh, the better. Weighing is very helpful in rebuttal, but NEEDED for me to vote in Summary and FF. With the new 3 min summaries, I see no reason why you shouldn't be able to weigh in summary. No new weighing in 2nd FF, new weighing in 1st FF is unfavorable but if it's the only weighing in the round and they don't respond to it then like eh. If both teams win their weighing and cases and there is no meta weighing then I will vote for the team whose weighing was introduced earlier in the round (prereq/link ins weighing doesn't apply here bc if one case is a prereq to another then u vote for the prereq/link in). Does this favor the 1st speaking team? No, you can weigh (and do other fun things) in 2nd constructive. Unrelated but remember to weigh turns over contentions. If nobody weighs then i honestly won't know what to do. I thinks its probably interventionist to pick which argument is better if both teams win their args. jUsT mAk3 mY lyfE eAs1eR!!! How I make my decision: Weighing debate first. I vote on the weighed args first but if nobody weighs then i be big sad, but I'll vote on cleanest/clearest path to the ballot. I thinks its probably interventionist to pick which argument is better if both teams win their args and the paths are both clear/clean. If there is no offense in the round then I flip a coin to decide who picks up cuz choosing any other way is interventionist, but feel free to make warranted arguments abt defaulting to one side or speaking order. I will always disclose after the round and give an RFD. also PS lmfao u need to win the link into the impact that u weighed.  Other: I will reward you for taking risks like collapsing on only a turn. Please signpost and tell me where you are on the flow. I hate dumb analogies, chances are, even if you think you're funny, you're not. Don’t call me judge, that’s weird. If a tournament is side-locked, if both teams agree to flip a coin the normal way (winner of the toss decides speaking order or side (their choice), the other team decides the other), I'm fine with that. I think side-locking makes no sense and is very harmful to pf as an activity when certain topics skew neg. for every link into tourism you read, +.5 speaks lol. i will never ever ever make any comments abt what you're wearing or how you speak. if a judge ever does, that's pretty fucked up. i don't care if u show up in designer clothes or sweats. i enjoyed debating in sweats, it's comfy. in outs, if i'm on a panel that's 2 other lays, u can tell me to judge it like a lay round and i will. (this means voting for the team that better establishes a narrative and is more convincing lol) Do crazy shit fr fr: g0 cRaaazeEEy!! tbh unpopular opinion but evidence is dumb, debate should be logical. obvi like use evidence if u want but warrants/analytics are perfecto. I genuinely think that debate would be better if it was just logical warranting, evidence is bad. (obviously evidence matters but: warrant + authors name vs. just warrant? meh p equal unless u give me good reasoning to prefer the evidence. unless the evidence is like a fact like ""x has increased y 200%"" is obviously better than a reason why x doesn't increase y) If at any point you believe that you have won the round with no way for the opponents to win, you can call a TKO, if you are correct it will be an auto W with 30s, but if you are incorrect it is a loss with 25s. Give a rebuttal in 2nd constructive (1st rebuttal will have to frontline if this happens) (if you read fast enough, you can still do case!) instant 30 if u do this cuz lol. Above all, just have fun! Debate can get stressful so just try to breathe, chill and relax in round. I WILL DISCLOSE AFTER EVERY ROUND NO EXCEPTIONS— HOLD ME TO THIS A haiku describing my judging philosophy: Weigh Warrants Logic Collapse Analysis Links WEIGH WEIGH COLLAPSE WEIGH plz remind me of how many speaks you should win based all the crazy stuff in here lol i'll forget what i put here ",3
"Please make your framework clear and, when necessary, address why your framework should prevail. When you clash with your opponents, I will judge your case based on how you weigh your arguments' significance relative to your opponents' arguments. Please do not spread. If you do, I may miss an argument or response. Do not be obnoxious with evidence transfer. Be efficient and do not eat up time unnecessarily rushing to find pieces of evidence. By the same token, only ask for those things that are crucially necessary to your responses. ",2
"I am a college student that competed in debate for six years from 7th - 12th grade. For debate I have no problem with speed, but please make sure I can understand points that are very important to your case. If is a key point, emphasize it and enunciate. I will only judge based off of what is said in the round. If you want me to know or do something you must tell me and make it painfully obvious to me what you want me to do. Please use supporting evidence in your arguments. If your argument doesn't have any supporting evidence or data, I will not take it as seriously as an argument with supporting evidence. ",2
"he / they My email for the chain is hbharper8@gmail.com but also feel free to reach out with questions about your round I am okay with anything you run as long as you are respectful Fun Facts: I do not like voting for disclosure theory nor topicality. On their own these arguments do not convince me, but I am open minded if you can make them really well No changing the structure of the round with theory I don't expect you to necessarily run a counterinterp against theory - I just want to see you engage with the argument You probably go for too much in summary In summary defense is sticky unless it was frontlined The second rebuttal should address the first rebuttal but I will accept responses in second sum as well, but no new turns No offensive off-case arguments in the second rebuttal Speaker points: Please do not call me sir. I appreciate funny taglines and puns when they are in good taste Yelling / being mean in cross will hurt your speaks ",2
